COD SUJETO;SEXO;EDAD;TRATAMIENTO;SESION;RELATO;;;;;;;
L18H;F;VIEJO;Con higiene;T1;"Era una chica que se levantaba y desayunaba cafe, dude si era cafe con leche creo que si
hacia unas tostadas con un dulce de frutas creo frutilla, despues tomaba el subte la linea D para ir al trabajo en recoleta cuando llego tuvo una reunion por unas toallitas lady no me acuerdo despues pidio delivery para almorzar, volvio a su casa, hizo una rutina se cambio toda la ropa se puso eopa deportiva y fue a hacer las caminata, que era una rutina que la hacia siempre en el mismo lugar Cuando llego a su casa no me acuerdo supongo que habra cenado, y cuando llego leyo el psicoanalista y se acosto
";;;;;;;
L18H;F;VIEJO;Con higiene;E2;Un chico se levanta, se higieniza se lava los dientes, escoge la ropa para ir al trabajo entre dos camisas una rayada a otra a cuadros, elige la segunda, pone agua para unos mates prepara una tostada con manteca y dulce de leche y a las 8 toma el bolso y sale de su casa para el trabajo va a la estacion caballito que queda a unas 5 cuadras de su casa, se dirige al final del anden, espera unos 15 min que llegue el tren, cuando llega a la oficina se prepara para cmenzar a escuchar unos llamados, despues que temina de trabajar vuelve a su casa, ah el trabajo era en la zona de no me acuerdo Cuando vuelve a su casa decide limpiar el patio, despues queria probar unos juegos con la playstation, uno de aventura, y el otro no se era entre 2 juegos despues decide jugarlos pero se aburre, y va a leer un libro y decide leer un libro;;;;;;;
L18H;F;VIEJO;Con higiene;T2;Un muchacho federico  habia tenido una noche de descansno tranquila, se levanto puso agua para el mate, comio pan con dulce de leche, se cambio para ir a trabajar tuvo que elegir entre dos camisas una a cuadros y otra rayada, eligio la segunda opcion creo q era la rayada. despues fue tomo el tren, camino unas cuadras hasta la estacion de tren lo espero unos 15 min al final del anden y fue hasta est caballito. Llega al trabajo, se dispuso para hacer llamadas telefonicas, despues llega a la casa, y juega unos jueguitos que tenia en la playsation, emieza a investigarlos se aburre y se sienta a leer.;;;;;;;
L19NH;F;VIEJO;Sin higiene;E1;Presentaban el dpto, a la hora q se levantaba lo qur desayunaba, se iba en subte al trabajo en una oficina, de diseño o publicidad, se toma otro cafe en la oficina, antes de eso hacia llamadas telefonicas, despues tuvo una reunion para un nuevo producto de toallas femeninas, mando mails comio en el escritorio despues de la oficina hizo las compras en el super vuelve a la casa se cambio de ropa hizo ejercicio y despues se habia ido a una cita en un bar, volvio a la casa leyo unos libros no se si contesto unos mails y se durmio tarde.;;;;;;;
L19NH;F;VIEJO;Sin higiene;T1;Mostraba un dormitorio, despues una cocina despues mostraba una oficina un escritorio, mostraba como una sala de reuniones con varias personas, despues creo que estaba corriendo alguien, despues la imagen de un supermercado, iba narrando un dia en la vida de esta mujer. Se levantaba, desayunaba,llegaba a la oficina, habia ido de compras, se reunia con amigas hacia ejercicio, se encontraba a tomar algo con las amigas. creo q tenia una cita, llegaba a la noche;;;;;;;
L19NH;F;VIEJO;Sin higiene;E2;Esta durmiendo, se despierta se ve a alguien durmiendo en una cama despues va hacia el placard a elegir la ropa entre una camisa azul y una a cuadros, se lava la cara, los dientes, despues va a desayunar mate con dos tostadas, despues sale con su bolsa a la puerta de su casa camina creo que 5 cuadras hasta la estacion de tren, en la est caballito. Espera el tren, llega al trabajo y saluda  a sus compañeros y se pone a tomar un cafe. Habla por tel mira la computadora, despues de su jornada de trabajo saluda para irse y se va a su casa y decide ir al jardin y se la ve limpiando un vidrio, despues decide jugar con la play 4, habia bajado la noche anterior unos juegos se pone a jugar pero se aburre, decide leer un libro sentado en una mesa con la ventana que le entra luz, toma un te.;;;;;;;
L19NH;F;VIEJO;Sin higiene;T2;La vida de un muchacho, que se levantaba desayunaba, despues se iba a trabajar, hacia ejercicio, iba a comprar, creo o era la chica? Me queda grabada la cocina que se preparaba unas tostadas, tomaba el tren o el subte, que vivia en caballito;;;;;;;
L20NH;F;VIEJO;Sin higiene;E1;Una chica se levanta desayuna, se prepara para ir a trabajar, cerca de retiro. Llega al trabajo se pone  amirar mails, tiene programados varios mails o 4 creo que dice. se reune se ve una reunion de trabajo de estrategias, xq es una empresa de toallitas o vende toallitas. Habla con su jefa antes. Almuerza despues vuelve a su casa pasa x el super, compra paga en efectivo, vuelve deja todo se va a correr se pne una musica q le gusta para ir a correr. Corre masomenos media hs cuarenta min. Vuelve se arregla se va a una cita de tinder que arreglo a un bar de la calle tacuari, se va a la barra a esperar la cita, vuelve, lee el libro el psicoanalista y se duerme.;;;;;;;
L20NH;F;VIEJO;Sin higiene;T1;Era la historia de un dia en la vida de una chica- se levantaba habia dormido bien, tomaba el desayuno, vivia en la calle charcas se iba en el subte a trabajar al centro, en la estacion carranza de subte. Se iba al centro tennia un par d reuniones hablaba con la jefa, almorzaba, despues se volvia a su casa hacia compras por el camino, se cambiaba se ponia ropa deportiva se ponia los auriculares y se iba a correr un poco. Volvía, se cambiaba se arreglaba u se iba a un bar a una cita de tinder. Despues volvia de la cita y se iba a dormir;;;;;;;
L20NH;F;VIEJO;Sin higiene;E2;Era un muchacho Federico, se levanta despues de dormir bien, se va al baño, higieniza, se va al placard, elige entre dos camisas una a cuadros y una a rayas azules, va al baño se lava los dientes se pone gel en el pelo, se lava la cara. se hace mate con tostadas con queso cena y dulce de leche. Sale alrededor de 8.30 camina unas cuadras, vive en la calle bacacay, camina a la estación de tren de caballito, cinco cuadras, va a la estacion de once xq va a la calle saavedra a trabajar , llega atiende llamados en la computadora saluda a sus compañeros etc, cuando vuelve limpia los vidrios de su patio, despues se pone a jugar a la play xq se descargo dos distintas, una de aventura la otra no me acuerdo, juega a una pero se aburre entonces se va al lado de la ventana a leer un libro;;;;;;;
L20NH;F;VIEJO;Sin higiene;T2;Un hombre que se despertaba se veia una cama de dos plazas, se aseaba, despues se veia una foto de su placard abierto con varias prendas, el elegia entre dos camisas una como labradora a cuadros y una rayada en azul  creo, despues desayunaba se veia de afuera la cocina. desayunaba queso blanco y dulce de leche. despues vivia en caballito tomaba el tren iba a trabajar al trabajo de la calle saavedra. Llega y se sienta al escritorio para trabajar con la computadora despues creo que iban a comprar algo de comer despues volvia a su casa y limpiaba su casa y creo que despues se iba a tomar algo con los amigos, puede ser cerveza;;;;;;;
L22H;F;VIEJO;Con higiene;E1;Juana se levanta  a las siete de la mañana, desayuna un cfe con leche con dos tostadas con mermelada de frutilla y luego de dirige a sus tareas toma el subte, en la estacion carranza, y va hasta la estacion creo que dijo charcas en recoleta. Llega a su oficina a eso de las 8 am conversa con su jefa pero antes hace unos llamados, despues con los proveedores sobre el diseño supongo que sera diseñadora, 8 y 30 se reune con alguien para hablar de su trabajo, trabaja en los apositos de lady soft luego cuando reglresa a su casa se pone la ropa de sport y sale a caminar,;;;;;;;
L22H;F;VIEJO;Con higiene;T1;Vi una imagen que era un departamento un dormitorio, supongo que era la casa de Juana, Juana es una diseñadora se levanta  a las 7 y media desayuna un cafe con leche con dos tostadas con mermelada de frutilla, va al teabajo a las 8, sale de la estacion carranza y va hacia recoleta a la calle charcas se encuentra con su jefa charla, luego sobre su trabajo que es diseñadora, luego atiende a un proveedor que le comenta sobre las toallitas lady soft y por la tarde regresa a su casa se pone ropa sport, deportiva, zapatillas y sale a correr unos 40 min.;;;;;;;
L22H;F;VIEJO;Con higiene;E2;Federico vive en le barrio de caballito, se levanta  a las 8 de la mañana desayuna dos tostadas con queso y ddl toma el bolso y se dirige a la estacion caballito para ir a su trabajo a la calle saavedra en once. Llega a su ofivina enciende la computadora saluda a sus compañeros y hace sus tareas. Regresa a su casa y en el camino adquiere dos juegos para la playstation uno de carrera el otro no me acuerdo, llega a su casa se pone a jugar no le gustan los juegos entonces se pone a leer un libro cerca de la ventana- luego se va al patio a arreglar el patio.;;;;;;;
L22H;F;VIEJO;Con higiene;T2;Federico se levantaba por la mañana todos los dias a las 7 de la mañana desayuna mate con dos tostadas con queso y dulce de leche, recuerdo que estaba en la cocina, tengo la imagen grabada. Luego se dirige a la est caballito toma le tren, va a la estacion once a la calle saavedra. Alli tiene su oficina, llega hace unos llamada abre la compu, luego regresa a su casa, trae los juegos dos juegos de la play uno era de carreras el otro no recuerdo, se pone a jugar, no le agrada, y entonces toma un libro y se va a leer cerca de la ventana.;;;;;;;
L23NH;M;VIEJO;Sin higiene;E1;La protagonista se levanta  a las 7 y media, vive en el departamento de la calle charcas en el cuarto piso, para ir al trabajo se toma el subte d ministro carranza y tiene el trabajo en recoleta. A las 8 y media ocntesta los mails, tenia para contestar de proveedores y a un diseñador grafico, a la mañana toma un desayuno ya en la casa el cafe y despues otro cafe en la oficina. Despues tiene creo que 12 .30 la reunion de trabajo con su equipo . Al salir del trabajo pasa x el super compra frutas y verduras y paga en efvo. Despues se prepara para hacer su rutina diaria de gimnasia, se viste, sale a correr, corre todos los dias x el mismo lugar durante 40 min. y despues se prepara para una salida una cita que arreglo x tinder y va al bar mishigene y despues vuelve para la casa se acuesta y demora 30 min en dormirse.;;;;;;;
L23NH;M;VIEJO;Sin higiene;T1;Bueno una chica que se levanta a las 7 y media en su departamento del cuarto piso, se prepara para ir al trabajo se va en subte la linea D. En el trabajo tenia reunion con su jefe. antes de volver a la casa tenia una cita con alguien de tinder en el cafe o bar que se llamab mishigene. despues d ela cita volvia a la casa y tenia su rutina gimnastica salia a correr durante creo 20 minutos, volvia a la casa, habia comido con el candidato en mishiguene. despues sale a correr a la calle vuelve y creo que eso es todo.;;;;;;;
L23NH;M;VIEJO;Sin higiene;E2;Federico se levanta  a las 7 y media de la mañana va a su armario tiene que elegir que ponerse esta entre una camisa a cuadros y una rayada, se queda con una rayada, va al baño se lava la cara creo q con gel se lava las manos los dientes- desayuna cafe y dos tostadas con manteca, no con dulce de leche. despues ah vive en bacacay de caballito. se va al trabajo toma el tren en la estación de caballito, va caminando, esta soleado aunque humedo. el tren tarda quince min en llegar. va al trabajo se encuentra con los compañeros, y esta listo para hacer las primeras llamadas. Despues vuelve a la casa en subte, primero para darse un gusto se habia bajado dos juegos en la play qu queria probar, pero se aburre y sigue leyendo un libro, tenia que tomar la decision sobre que hacerse de cenar.;;;;;;;
L23NH;M;VIEJO;Sin higiene;T2;ERa la cronologia de un muchacho se despierta, recuerdo el tema de las camisas que tenia las dudas de que ponerse, tenia una cuadrada y una rayada, se queda con la rayada y despues recuerdo que en la filmina siguiente sale con una remera negra para el trabajo. tambien va al trabajo me parece con subte y despues cuando volvia del trabajo lo que tenia que cocinar y creo que se toma tambien un yogur. Ah juega a la play tambien me parece que si, y no me acuerdo que mas.;;;;;;;
L24NH;F;VIEJO;Sin higiene;E1;Una señora duerme se levanta a la mañana desayuna cafe con leche con tostadas de frtilla despues baja se va a su trabajo y toma el subte D, y llega a su trabajo revisa lo que tiene en la computadora se toma un cafe, despues mira los mails y se va con la jefa. Al mediodia almuerza y despues descansa vuelve a trabajar y cuando sale de su trabajo va al supermercado compra lacteos y verduras, vuelve a su casa se saca la ropa se pone la ropa deportiva hace gimnasia y hace siempre el mismo recorrido lleva su botellita de agua, llega a su casa, cena, mira la tele vuelve a mirar la computadora y se acuesta;;;;;;;
L24NH;F;VIEJO;Sin higiene;T1;se ve una cama, la señora se esta bañando despues desayuna, se cambia, se va a tomar el subte la linea -d xq va a trabajar a recoleta, llega abre la pc ve los mails y ve todo el trabajo que le mandaron tambien con una tacita de cafe y unas galletitas de frutilla y se va a ver a su jefa. despues va al supermercado antes de ir a su casa compra verduras y lacteos, se pone la ropa deportiva agarra la botellita de agua se va a caminar siempre x el mismo lugar, vuelve llama al delivery,y despues la veo en la cama. ve algo en la tele y se va a dormir;;;;;;;
L24NH;F;VIEJO;Sin higiene;E2;Un muchacho, se despierta a las 7 y media de la mañana. Vive en la calle Bacacay en Caballito.  Despues de eso se va a su ropero en donde tiene que elegir  como va a vestirse. Mira y tiene dos opciones una camisa a cuadros y la otra creo que era rayada. Al final se queda con lasegunda opcion. Luego de eso, va al baño se lava la cara se peina, se pone gel y se lava las manos, los dientes Se dirige a la cocina, pone el agua, Desayuna cafe y se hace dos tostadas con dulce de leche. Para ir al trabajo va caminando a tomar el tren en la estación de caballito. El dia esta soleado pero feo, humedo creo que dice.Espera el tren quince minutos . Cuando llega al trabajo se encuentra con los compañeros, y hace unos llamados. Cuando finaliza vuelve a la casa en subte, se habia bajado juegos en la playsation que queria probar, pero se aburre y se pone a pensar que hacerse de cenar. Despues se pone a leer un libro.;;;;;;;
L24NH;F;VIEJO;Sin higiene;T2;Bueno es la historia de un hombre que se despertaba en su cama de dos plazas, de su casa de Caballito. Desayunaba algo, se higienizaba e iba a su placard. Tenia varias camisas para ponerse, y finalmente el elegia entre dos camisas una como a cuadros azules y la otra rayada  colorida  creo, despues desayunaba se veia de afuera la cocina. Se hacia unas tostadas con queso  crema. Para ir al trabajo caminaba 5 cuadras y tomaba el tren porque trabajaba en Once. Al llegar saluda y se pone a trabajar  Al finalizar, volvia a su casa y limpiaba el patio;;;;;;;
L25H;M;VIEJO;Con higiene;E1;Un señor se levanta temprano va a buscar que ponerse, esta decidiendo entre dos camisas, una cuadriculada y otra creo que colorada. Sale de la habitación y se dirige al baño, un baño muy lindo, bastante completo el baño. se lava los dientes la cara, se dirige a la cocina, muy completita la cocina tipo americana. Se prepara un desayuno que no me acuerdo que era. Y sale se dirige hacia su trabajo con un bolso, el vive en caballito,camina unas 5 cuadras para llegar a la estacion caballito, pierde 15 min hasta que viene el tren, toma el tren y se dirige a once a la calle saavedra, donde esta su puesto de trabajo que aparentemente es de atender llamadas telefonicas. Antes habia saludado a los amigos, Terminada su jornada de trabajo cierra todo, sale se vuelve en subte a su departamento. Pinta o arregla las plantas en el patio. Se distrae un poquito jugando con la play 4 con un par de jueguitos que habia bajado.Luego se va a escribir a una ventana que no se porque entra sol porque ya es de noche jaja;;;;;;;
L25H;M;VIEJO;Con higiene;T1;Salia un señor temprano a la mañana se levantaba habia mucho sol, desayunaba en una cocina muy bonita un departamento muy moderno. Iba a tomar el tren a la estacion caballito, estaba en la zona de once. tenia una serie de actividades con su gente, se dedicaba a su trabajo creo que telemarketing o algo parecido. Despues volvia en horas de la tarde en subte puede ser? Y no me acuerdo mas;;;;;;;
L25H;M;VIEJO;Con higiene;E2;Una niña que se levanta temprano, toma el desayuno, sale en el subte para su trabajo en el departamento en la calle charcas , ella sube en la estacion carranza. Llega a la oficina se pone a revisar correos electronicos. Alrededor de las 8 y media tiene una reunion de trabajo, creo que es diseñadora grafica y esta haciendo un estudio sobre toallitas intimas. A la tarde vuelve a su casa, se cambia la ropa, previo haber pasado por el supermercado, deja las cosas, sale a correr con una botellita de agua por las dudas. Entra a un boliche a la tarde, vuelve revisa los correos sus redes sociales y despues a dormir.;;;;;;;
L25H;M;VIEJO;Con higiene;T2;Una chica se levantaba temprano, vivia por el centro, desayunaba, tomaba el subte, se iba al trabajo que estaba en recoleta. Despues de haber desayunado llegaba al trabajo, revisaba algunos mails, charlaba por tel a un diseñador grafico. Despues de hacer sus tareas hablaba con la dueña de la empresa aparentemente. Despues a la tarde se iba a su casa tomaba el subte, llegaba a su casa se cambiaba la ropa iba a hacer gimnasia, volvia, arreglaba una reunion por tinder. Tenia una reunion con alguien a la noche, volvia a su casa hacia cosas que no se deben como leer el cel antes de acostarse, estaba en redes sociales, y despues se dormia . En el medio no se sabe que hizo.;;;;;;;
L26H;F;VIEJO;Con higiene;E1;Federico se despierta 7y 30 de la mañana, se levanta, va al baño y se pone gel en el cabello y se cepilla los dientes y se lava la cara Se prepara el desayuno se prepara dos tostadas con queso crema y dulce de leche. Primero elige va a su placard y entre todas las camisas que tiene para ponerse elige entre una camisa a cuadros, de colores y otra azul a rayas, se viste y se va a desayunar. Sale de su casa a las 8 de la mañana, es un dia humedo y soleado vive en la calle bacacay de caballito, camina 5 cuadras hasta la estacion del subte de caballito, llega a la estacion, va al final del anden para dirigirse a su trabajo. Despues de 15 min se baja tiene su trabajo en la calle saavedra, llega a su trabajo se prepara un cafe, y comienza a hacer las llamadas del dia . Al finalizar su trabajo regresa a su casa, primero se pone a jugar con los videojuegos que tiene dos que habia visto la noche anterior de carreras y el otro Piensa mientras esta con los juegos que comida va a preparar para la cena Despues de un rato el juego lo aburre y se dirige a preparar un te verde y al lado de una ventana se pone a leer un libro.;;;;;;;
L26H;F;VIEJO;Con higiene;T1;Un joven, Federico, cuenta como estaba en la cama y se despierta creo q 7 y media de la mañana despues de haber pasado una buena noche, se levanta, va al placard, ve la ropa que tiene para ponerse, tiene dos camisas, una a cuadros a colores y la otra azul a rayas, y elige la a rayas, y despues va al baño, se lava la cara, los dientes, y se coloca gel en la cabeza, y en el pelo, despues va a desayunar, prepara el desayuno Se hace dos tostadas con dulce de leche y queso. Sale de su casa a las 8 de la mañana vive en la calle Bacacay, camina 5 cuadras hasta Rivadavia donde sta la est del subte para ir a la oficina que esta en el barrio de balvanera en la calle Saavedra, en la est camina hasta el fondo del anden donde toma el primer vagón, sube y llega a su trabajo. Al llegar se sirve un café, despues se dirige a su escritorio y comienza a responder su trabajo de las llamadas del dia, despues de todo el dia de trabajo regresa a su casa se pone un poco con los videojuegos que habia estado jugando la noche anterior, dos juegos uno de aventura y otro de deportes carreras, se aburre y esta sentado en el escritorio al lado de uan ventana luminosa, piensa que va a hacer para la cena y despues de un rato de jugar se sienta a leer un libro;;;;;;;
L26H;F;VIEJO;Con higiene;E2;Juana no se si era, escuche varias veces. La imagen me pareció que no es la misma cuando estaba acostada que cuando empezo. A las 7 y media despues de una noche tranquila se levanta, no se la ve en la cama ya est a la cama deshecha de haberse levantado, para ir al trabajo, toma el desayuno, un cafe con leche con unas tostadas creo que con mermelada de frutilla, camina unas cuadras, No se si era la calle charcas en recoleta no escuche bien Camina unas cuadras hasta el subte D en la est carranza y se dirige a su oficina, al llegar lo primero que hace es hacer unas llamadas que tenia pendientes, a unos proveedores y diseñador grafico. Despues se pone a trabajar, toma un cafe, se sienta en su escritorio a trabajar. Al otro dia tiene una reunion de trabajo luego Al mediodia, bueno tiene una reunion de trabajo y después almuerza. Al finalizar su trabajo va para su casa, antes pasa por el supermercado, compra unas verduras y lacteos, paga en efvo, va a su casa se saca la ropa de trabajo se pone la ropa deportiva y sale a su entrenamiento diario, se pone una musica linda, y hacia otra cosa mas ah se lleva una botella de agua Y pone musica y hace su entrenamiento Luego tiene una cita en la calle tacuari en el centro, va y se sienta en la barra a esperar su cita. Posteriormente vuelve a su casa, antes de acostarse a dormir lee un libro el psicoanalista y mira su celular, sus mensajes o algo asi y despues de media hora logra conciliar el sueño.;;;;;;;
L26H;F;VIEJO;Con higiene;T2;Se trataba de una chica Juana o Ana no me acuerdo, se despierta a la mañana muestran la cama que se habia levantado no esta ella, se levanta, y va a desayunar desayuna creo que 7 y media se despierta, desayuna un cafe con leche con dos tostadas con mermelada de frutilla creo que era, sale para el trabajo, no se si era recoleta la calle callao, pero no recuerdo bien, toma va hasta el subte D de la linea D, hasta la direccion de la oficina, 8 y media llega  a su trabajo, llega a la oficina, hace unos llamados pendientes que tenia, con proveedores y diseñadores graficos, contesta mails despues y no se si eran llamados o mails, despues mas tarde tiene una reunion de trabajo con gente de la oficina, despues no me quedo muy claro si almorzaba o no me quedo claro, toma su almuerzo, continuo con el trabajo, sale despues para su casa Despues se dedica a su trabajo en la oficina llega a su casa se quita la ropa de trabajo se pone ropa deportiva para hacer su entrenamiento, se pone los auriculares para escuchar musica lleva una botellita de agua regresa, tenia una cita en un bar me quedo la calle tacuari no se si el bar estaba en la calle o su trabajo, no escuche bien Va al bar se sienta en la barra esperando que llegue alguien que tenia la cita, antes de llegar a su casa creo que entra en el super hace las compras, compra verduras y lacteos y paga en efectivo. Despues regresa se acuesta agarra el libro el psicoanalista lee, y se acuesta a dormir;;;;;;;
L27NH;F;VIEJO;Sin higiene;E1;Federico despues de dormir placidamente un lindo sueño, se levanta a las 7.30 de la mañana, abre el placard, elige camisa, se va a poner una azul o una a rayas, elige una a rayas, se va al baño, se lava los dientes, se higieniza, despues se va a la cocina se prepara dos tostadas con manteca o  queso crema con dulce de leche. Desayuna Termina de desayunar a las 8, sale, con una remera negra no sale con la camisa . Vive en la calle bacacay en caballito. Tiene que caminar 5 cuadras hasta la estacion de caballito, se va hasta el final del andén, tiene que esperar 15 min el tren, despues se va, trabaja en once sobre azcuenaga. entra a la oficina, saluda a sus compañeros, se prepara un cafe, prende la computadora y empieza a trabajar a debe ser tomando llamadas porque dice que empieza a recibir llamadas . se ve que se aburre con el tren, llega a su casa se pone a jugar a la play, no, primero decide limpiar el patio pero en el video limpiaba unos vidrios, y despues que termina de limpiar se va a jugar con 2 jueguitos que se bajo la noche anterior, no me acuerdo de que, se aburre y se va a leer un libro con un te verde y a tomar un poco de fresco delante de una ventana;;;;;;;
L27NH;F;VIEJO;Sin higiene;T1;Un muchacho como de 30 y pico, lindo, que dormia y se levantaba a las 7 y 30 se preparaba una taza de cafe, se preparaba el desayuno, comía dos tostadas con manteca y dulce de leche, se queria poner una camisa a cuadros pero al final cuando salia de la casa se ponia una camisa negra. Entonces se va a la estación de tren, para irse al trabajo con una mochilita, llega a su trabajo prende la computadora y se pone a laburar Despues llega a la casa pero vuelve en subte a su casa, limpia el patio pero estaba limpiando un balcon con unos vidrios, y despues se pone a leer en una ventana que le daba el solcito en una mesa. Y despues mira una pelicula creo o algo asi.;;;;;;;
