COD SUJETO;SEXO;EDAD;TRATAMIENTO;SESION;RELATO;;;;;;;
;;;;;;;;;;;;
S1NH;M;JOVEN;Sin higiene;E1;Juana tiene el departamento ubicado en Palermo Se levanta por la mañana desayuna baja a tomar el subte en la linea D va hacia la oficina en la oficina se toma un café a las 8 de la mañana responde los correos que tenía luego tiene una conferencia sobre nuevos productos de toallitas femeninas Por las tardes sale a correr en el barrio hace siempre el mismo recorrido Luego tiene una cita con una pareja en Tinder y por la noche a las doce de la noche se acuesta le lleva media hora poder dormir;;;;;;;
S1NH;M;JOVEN;Sin higiene;T1;Juana vive en palermo En la imagen veo un departamento  una habitación se levanta a la mañana a desayunar la imagen es de una cocina Luego va hacia el subte de la Linea D a tomar el subte hacia el trabajo La imagen de la estación de subte Luego en el trabajo se toma un café con medialunas La imagen es de un escritorio con un cafe con medialunas y una computadora A partir de las 8 empieza a contestar los mails atrasados Luego tiene una reunión por una conferencia sobre nuevos productos de toallitas femeninas La imagen es de un grupo de personas reunidas Por la tarde sale a correr en su barrio La imagen es de una chica corriendo Por la noche va a un bar a una cita con alguien por tinder La imagen de un bar En la noche se acuesta a dormir a las doce imagen de una chica acostada Le toma media hora dormirse;;;;;;;
S1NH;M;JOVEN;Sin higiene;E2;Luego de una noche de sueño Federico se levanta a las 7 y 30 de la mañana Luego abre su armario y busca que camisa ponerse Despues se dirige al baño a higienizarse Se pone gel en el pelo Después se dirige hacia la puerta Va hasta la estación de Caballito Se dirige hacia el trabajo en el trabajo se dirige hacia sus compañeros y se pone a atender los llamados Después de una jornada de trabajo va hacia la casa va en subte Limpia el patio luego de limpiar el patio juega a la play la noche anterior habia descargado dos juegos uno de carrera y uno de aventuras Los quiere probar Mientras juega piensa que cocinar para la noche Luego se aburre de jugar  se sienta en la ventana a tomar un poco de aire fresco tomando un té verde y leyendo un libro;;;;;;;
S1NH;M;JOVEN;Sin higiene;T2;Se levanta a la mañana en su departamento ubicado en Caballito Luego va al baño a higienizarse se pone gel en el pelo Desayuna va al trabajo en tren en once Al salir del trabajo va hacia la casa en subte Luego limpia la casa y se pone a jugar a la play a los juegos que se descargó la noche anterior uno de aventuras Mientras juega piensa que va a cocinar a la noche después se aburre a jugar y se pone a leer un libro frente a la ventana tomando un té;;;;;;;
S2NH;F;JOVEN;Sin higiene;E1;Luego de una noche tranquila de sueño Juana se levanta 730 en su casa tranquila de Palermo Toma un café con dos tostadas y se va a trabajar Toma el subte la linea D hacia el laburo Llega al laburo y en su oficina y se acuerda que tiene que hacer llamados al proveedor y al diseñador gráfico Luego de eso tiene una reunión donde hablan sobre toallitas intimas LadySoft A las 8: 30 toma un café y contesta correos Luego de eso se va a comprar compra verduras y lacteos Llega a su casa se cambia la ropa de oficina por otra deportiva y sale a correr Después de eso se sienta a tomar algo y espera a los invitados Llega a su casa se baña y se vuelve a acostar a dormir;;;;;;;
S2NH;F;JOVEN;Sin higiene;T1;Una chica se levanto a las 7 en su casa vivia en palermo Tomó un café con dos medialunas se fue al trabajo tomo el subte linea D llegó al trabajo contestó un email de los proveedores tuvo una reunión sobre toallitas después se fue a la casa se cambió salió a correr se juntó con amigos y volvió a la casa;;;;;;;
S2NH;F;JOVEN;Sin higiene;E2;Luego de una noche tranquila Federico se levanta a las 7 AM en su casa de Caballito Va al armario se pone a elegir la ropa tiene una camisa azul a cuadros y una negra Elige la ultima Va al baño se higieniza se peina se lava los dientes A las 8 va a la cocina pone el agua para el mate y se come dos tostadas Sale para la estacion Caballito Camina 5 cuadras es una tarde soleada pero húmeda Al llegar a la estación camina hasta el final del andén y a los 15 minutos viene el tren Al llegar a la oficina saluda a sus compañeros prende su computadora Luego se va y se pone a limpiar el patio de su casa Descansa un poco se pone a jugar a la PlayStation 4 que el día anterior descargó dos juegos uno de carrera y uno de aventura Los juegos lo aburren así que se pone frente a una ventana a tomar aire fresco se prepara un té verde y se pone a leer un libro;;;;;;;
S2NH;F;JOVEN;Sin higiene;T2;Fernando se despertó a las 7 en su casa de caballito Va al armario a elegir la ropa y tiene dos camisas Una a cuadros azul y una negra Elige la última Va al baño se higieniza luego a las 8 pone la pava para tomar unos mates con dos tostadas Sale a la calle hacia la estación Caballito Al llegar a la estación camina 15 minutos Camina hacia el último andén y a los 15 minutos viene el tren Llega al trabajo prende su computadora Después llega a su casa limpia su patio Se pone a jugar a la play 4 se aburre se pone a leer un libro tomando un té verde;;;;;;;
S3H;F;JOVEN;Con higiene;E1;Juana vive en el barrio de Palermo se levanta desayuna dos tostadas y después se va a trabajar Toma la linea D vive en la calle Charcas y toma la linea D en Carranza para ir a la oficina Responde unos mails que tenía atrasados y después tiene una nueva reunión por unos nuevos productos de toallitas femeninas LadySoft Cuando termina la jornada laboral va al supermercado compra unos productos lacteos unas verduras y se va a la casa Se prepara para hacer su entrenamiento semanal toma una botella de agua y se va a correr Después se va a un bar en el centro que se va a encontrar con alguien que conoció por Tinder;;;;;;;
S3H;F;JOVEN;Con higiene;T1;Juana es una chica que se levanta muy temprano se alista para ir a trabajar vive en la calle Charcas en Palermo a eso de las 7:30 se va a tomar el subte la línea D hasta Carranza en Belgrano que trabaja en una oficina responde unos mails que tenía atrasados después se va a una reunión para un nuevo producto de toallitas femeninas Después compra algunos lácteos y verduras y después se va a la casa Creo que se baña se va a hacer actividad física y después se alista para ir a un bar a tomar algo con una persona que conoció en Tinder;;;;;;;
S3H;F;JOVEN;Con higiene;E2;Federico vive en Caballito en la calle Bacacay se levanta a las 7 30 de la mañana va al baño a higienizarse se pone gel se lava la cara los dientes después va a su guardarropas esta indeciso entre dos camisas una azul a cuadros y una negra rayada Elige la segunda Después desayuna dos tostadas con dulce de leche y un café con leche y va hasta la estación de tren de Caballito al final del andén Después de 15 minutos viene el tren lo toma hacia su trabajo que queda en la calle Saavedra que queda en el barrio de Once saluda a sus compañeros se prepara un café y se sienta en la computadora a enviar unos mails Al finalizar la jornada laboral saluda a sus compañeros y se dirige a tomar el subte para regresar a su casa Cuando regresa a su casa se pone a limpiar el patio y después se pone a jugar a unos jueguitos que bajó la noche anterior en la play uno de carreras Pero se aburre y decide prepararse un té verde y leer un libro;;;;;;;
S3H;F;JOVEN;Con higiene;T2;Federico vive en caballito en la calle Bacacay se levanta a las 7 30 de la mañana va al baño a higienizarse se lava la cara los dientes después va a su guardarropa está indeciso entre dos camisas una azul a cuadros y una negra rayada Elige la segunda Después va a desayunar desayuna dos tostadas con dulce de leche y un café conleche y va hasta la estación de tren Caballito al final del andén Después de 15 minutos viene el tren y lo toma hasta su trabajo que queda en la calle Saavedra en el barrio de Once Saluda sus compañeros se prepara un café y se sienta en la computadora a mandar unos mails Al finalizar la jornada laboral saluda a sus compañeros y se va a tomar el subte para regresar a su casa Cuando regresa a su casa se pone a limpiar el patio y después se pone a jugar a unos jueguitos que bajó la noche anterior en la play Uno era de carreras pero se aburre y decide prepararse un té verde y leer un libro;;;;;;;
S4H;F;JOVEN;Con higiene;E1;Como todos los días Juana se levantaba a las 7 30 de la mañana desayuna un café con leche con dos tostadas con manteca y mermelada de frutilla Se arregló bajó hasta la estación Ministro Carranza para dirigirse hacia Recoleta donde queda su trabajo Una vez que llegó a la oficina realizó llamadas hacia proveedores que habían quedado pendientes A las 8 y 30 de la mañana respondía correos electrónicos atrasados Luego se reunió con su jefa a eso del mediodía tuvo una reunión en la cual se discutía el lanzamiento de la marca Ladysoft de toallitas femeninas Luego de la reunión llamó al delivery encargó su comida y en su horario de descanso almorzó Luego de su trabajo se dirigió al supermercado compró lácteos y verduras pagó en efectivo Fue a su casa dejó las cosas en la heladera se preparó se cambió se puso su ropa deportiva eligió su música preferida corrió durante 40 minutos y cuando volvió se bañó se preparó para ir a una cita que tenía por Tinder a un bar en la calle Tacuarí Mientras esperaba a su cita se sentó junto a la barra a tomar unos tragos A eso de la medianoche llegó a su casa se acostó se puso a leer el libro del psicoanálisis Después empezó a ver las redes sociales y después de media hora pudo dormir;;;;;;;
S4H;F;JOVEN;Con higiene;T1;Juana se levanta a las 7 30 de la mañana como todos los días se prepara su café con leche con tostadas con mermelada de frutilla cuando termina de desayunar se arregla baja hacia la estación Ministro Carranza para ir a su trabajo que queda en Recoleta Una vez que llega a la oficina recuerda que tiene que hacer llamados que le quedaron pendientes a proveedores A eso de las 8:30 de la mañana chequea correos electrónicos atrasados Luego se reúne con su jefa y masomenos al mediodía tiene otra reunión en la cual se discute el nuevo lanzamiento de la marca Ladysoft de toallitas femeninas Luego de la reunión pide su comida por delivery y come en su horario de descanso Una vez finalizado su trabajo va al supermercado compra lacteos y verduras los paga en efectivo y se dirige hacia su casa Cuando llega a su casa guarda las cosas del supermercado en la heladera y se cambia se pone la ropa de entrenamiento la cual como todos los días hace su rutina de 40 minutos de correr en la plaza del barrio Cuando termina se baña y se va a una cita que tenía en Tinder en un bar en la calle Tacuarí  se sienta junto a la barra esperar a la persona con la que quedó para verse A eso de la medianoche ella llega a la casa se recuesta se pone a leer el libro del psicoanálisis luego mira las redes y después de media hora se logra dormir;;;;;;;
S4H;F;JOVEN;Con higiene;E2;Luego de una noche de sueño placentero Federico se levanta a las 7 y 30 de la mañana en su casa ubicada en la calle Bacacay en el barrio de Caballito Luego de levantarse abre su armario donde tiene todas sus camisas y tiene dos opciones a cuadritos azules o rayada de colores Elige la opción 2 rayada Luego va al baño se peina se pone gel se lava los dientes y la cara Luego va a la cocina pone la pava para tomar mate se prepara dos tostadas con queso crema y dulce de leche Luego de desayunar agarra su bolso a eso de las 8 de la mañana y se dirige hacia la puerta de la casa Es un día soleado y húmedo Camina 5 cuadras hasta la estación de tren de Caballito Una vez que llega a la estación va al final del andén y espera 15 minutos Llega a la empresa saluda a sus compañeros se prepara un café prende la computadora se pone a realizar llamados Luego que termina su trabajo saluda a sus compañeros se dirige hacia su casa toma el subte y decide ponerse a limpiar el patio de su casa Luego de eso se pone a jugar a la playstation la noche anterior había comprado dos videojuegos y quería probarlos mientras jugaba pensaba que iba a cocinar a la noche Se aburrió de jugar a la PlayStation se sentó a tomarse un té verde bajo la ventana a leer un libro;;;;;;;
S4H;F;JOVEN;Con higiene;T2;Después de una noche de sueño placentera a las 7 y 30 de la mañana Federico se levanta en su casa situada en la calle Bacacay en el barrio de Caballito Abre su armario tiene dos opciones la camisa cuadritos azul o la rayada a colores Elige la rayada Se dirige al baño se higieniza se lava la cara los dientes se pone gel se peina y va hacia la cocina a poner la pava para tomar mate se prepara dos tostadas con queso crema y dulce de leche Luego de finalizar el desayuno agarra su bolso y se dirige hacia la puerta de su edificio Al salir el día está soleado y húmedo Camina 5 cuadras hacia la estación Caballito se va hasta el final del andén y espera 15 minutos a que llegue el tren Cuando llega el tren se dirige hacia el trabajo en el barrio de Once Llega a su trabajo saluda a sus compañeros se prepara un café se sienta a realizar llamados que quedaron pendientes luego de finalizar su horario de trabajo sale va hacia la estación de subte para volver a su casa llega a su casa decide arreglar su patio Una vez que finaliza de arreglar su patio se sienta a jugar a la play y prueba los dos jueguitos que compró la noche anterior Mientras juega con la play piensa que es lo que va a cocinar Se aburre de jugar a la play  se sienta a leer un libro y se toma un té verde;;;;;;;
S5NH;F;JOVEN;Sin higiene;E1;Laura después de una noche tranquila se levanta a las 7 30 en su casa de Palermo. Desayuna un café con leche con tostadas con manteca y dulce de frutillas y agarra su bolso y se va al trabajo se toma el subte línea D y se baja en Recoleta. Cuando llega a la oficina se acuerda que tiene que llamar a proveedores y al diseñador gráfico y se toma otro café más tarde tiene otra reunión con su jefa a las 8:30. Antes del mediodía tiene otra reunión con el equipo sobre el nuevo lanzamiento de unas toallitas LadySoft. Después pide la comida por Delivery y cuando sale, pasa primero a hacer las compras. Le faltaban lácteos y verduras. Paga en efectivo. de ahí se va a la casa, cuando llega a la casa se saca la ropa del trabajo se pone ropa deportiva, agarra una botella de agua y sale a correr por 40 minutos. Hace siempre el mismo recorrido. vuelve de correr, se baña y se prepara para ir a una cita que había conocido a alguien por Tinder. Vuelve a su casa a la medianoche, se acuesta, lee un libro el psicoanalista y después de media hora logra conciliar el sueño.;;;;;;;
S5NH;F;JOVEN;Sin higiene;T1;Laura se levanta a las 7 y 30 después de una noche tranquila en su casa en el barrio de Palermo, vive en un cuarto piso, desayuna tostadas con manteca y mermelada de frutilla y un café con leche, después se prepara agarra su bolso y se va al trabajo. Se toma la línea D del subte y se baja en recoleta. Llega al trabajo y se toma otro café con leche a las 8:30 tenía una reunión con proveedores y más tarde con su jefa, después de eso tuvo una reunión con su equipo porque iban a sacar un comercial de toallitas femeninas Lady soft, después cerca del mediodía pide delivery, almuerza, después vuelve a su casa a la tarde llega se cambia la ropa se pone la ropa deportiva, sale a correr hace siempre el mismo recorrido cuando vuelve se lleva una botella de agua y cuando vuelve se cambia se arregla se baña porque tiene una cita con alguien que conoció en Tinder. Sale, lo espera sentada en la barra, se iban a encontrar en un bar. A la noche vuelve y antes de irse a dormir chequea sus redes sociales, lee un libro el Psicoanalista y se acuesta. En las imágenes, la primera imagen era una habitación con la cama desarreglada, un acolchado gris, una mesa de luz , una habitación muy luminosa. En la segunda aparece ella sentada, en la tercera se muestra un poco más de su casa, después la imagen de la estación de subte había bastante gente. Después está la imagen de la oficina , donde ella se sienta en la computadora había una silla de color negro, había unas estanterías blancas, después de eso es la imagen de la reunión, había mucha gente , una oficina más grande, una mesa amplia, Luego de eso estaba la imagen de nuevo de un escritorio con la bolsa de la comida que había pedido, también pasaba a ser unas compras en la imagen estaba los lácteos y frutas y verduras. Pagaba en efectivo. Todo muy colorido. Después la imagen de la casa con las bolsas de compra arriba de la mesa, había una mesada en el medio, después cuando ella se cambia y sale a correr está ella corriendo muchos arboles en el fondo tenía puesto un topcito violeta después la entrada de la casa tenía lucecitas en la vereda, bueno y después la imagen de ella leyendo de costado en la cama, con el libro.;;;;;;;
S5NH;F;JOVEN;Sin higiene;E2;Luego de una noche tranquila Federico se levanta en su casa ubicada en la calle Bacacay en Caballito. Se levanta va al baño se cepilla los dientes, después va a elegir una camisa en su armario está entre dos opciones una a lunares y otra azul a rayas y elige ponerse la azul. Va a la cocina pone a calentar la pava para tomar mate se hace dos tostadas con queso y dulce de leche. De ahí se dirige a la calle, el dia esta calido pero húmedo, se dirige hacia la estación de tren de caballito. Después de 15 minutos llega el tren. Llega al trabajo ,se toma un café prende la computadora y empieza a trabajar. A la hora que finaliza su jornada laboral sale va a la casa cuando llega a la casa va a jugar un rato a la play y se descargó dos juegos la noche anterior, uno de carreras y el otro no me acuerdo. Los quería probar después de un rato se aburrió mientras pensaba que preparar para la cena. fue a leer un libro en frente a la ventana para tomar aire fresco, se preparó un té verde y se puso a leer. En la primer imagen está él, tapado, unas sábanas a rayas, en la segunda imagen hay un armario bastante grande con muchas camisas y mucha ropa, la tercera es un baño todo blanco, la cuarta es la cocina muy blanca tiene una heladera plateada, un microondas plateado también y utensilios colgados.La otra imagen es él , tiene una mochila puesta, va caminando por la calle, en otra se muestra la imagen de la estación de caballito, es un tren celeste, en la oficina se ve la taza de café arriba de la mesa, la computadora, libros, después es él jugando con el joystick de la play de color azul, después de eso está él sentado frente a la ventana. La habitación parecía cómoda.;;;;;;;
S5NH;F;JOVEN;Sin higiene;T2;Luego de una noche tranquila Federico se levanta a la mañana en su casa ubicada en Caballito, se levanta va al baño, se cepilla los dientes luego va a su armario y elige para ponerse entre dos opciones de camisa, una rayada azul después de ahí va a su cocina se prepara unos mates con tostadas para desayunar, tostadas con queso crema y dulce de leche o manteca y dulce de leche. Sale a la calle, es un día soleado pero húmedo. Va a la estación del tren, se toma el tren para ir al trabajo, cuando sale del trabajo vuelve a la casa se despide de los compañeros, vuelve a la casa limpia el patio se sienta a jugar a la play que estuvo descargando juegos el día anterior uno de carrera y otro de peleas. Los prueba después de un rato se aburre y se sienta a leer el libro frente a la ventana se prepara un té. En la primer imagen está él levantándose, es un chico con barba. El baño es bastante blanco, el armario se ve amplio con muchas camisas colgadas bastante ropa. Después la cocina, blanca con una heladera, un microondas plateado. Después el saliendo del edificio en la calle, después la calle en si, la estación del tren y el tren, con bastante gente, después el trabajo hay una oficina, después se ve a él limpiando el patio, hay un silloncito y el limpian los vidrios. Después de eso el sentado jugando a la play de espaldas, el joystyck era azul. Y después él sentado en un escritorio que le da el sol, leyendo un libro y con su taza de té blanca sobre el escritorio.;;;;;;;
S6NH;M;JOVEN;Sin higiene;E1;Juana se levanta temprano para ir a trabajar, la cama estaba hecha, se levanta a tomar un café, agarra su bolso para ir a trabajar, después Juana llega a la oficina donde tenía que entregar unos documentos, después se junta con los amigos en otra oficina, que tiene que hacer algo de las toallitas Ladysoft, después de terminar el ciclo de trabajo se va a comprar alimentos al supermercado, va a la casa, guarda los alimentos, va a caminar siempre por el mismo camino, media hora, después se va a un bar a encontrarse con un chico que conoció por Tinder, después se va a su casa y después de media hora logra conciliar el sueño .;;;;;;;
S6NH;M;JOVEN;Sin higiene;T1;Juana se levanta para ir a trabajar la cama está hecha se toma su café se va para el trabajo va a su oficina se nota que tiene trabajo en la oficina,después se junta con los compañeros de trabajo eran 4 hombres y 3 mujeres. Después Juana se va al mercado, se compra su alimento, se va para la casa, en la parte de alimento era todo comida frutas, todo vegetariano. Después se va a correr, tipo tardecita. después se va a encontrar con un chico que conoció en Tinder en un restaurante. Después mira un video en el celular hasta que le agarren ganas de dormir, y se va a dormir.;;;;;;;
S6NH;M;JOVEN;Sin higiene;E2;Federico se levanta a las 7:30 en la calle Bacacay se levanta abre el armario y decide entre dos camisas una de rayas y una azul . Elige la segunda opción. Se va al baño, se lava la cara , se peina, se cepilla los dientes, después de eso, se hace dos tostadas y toma el mate. Después del desayuno camina dos cuadras, para tomar el tren que tarda 15 minutos masomenos. Cuando llega al trabajo, saluda a sus compañeros y se pone a atender llamadas. Cuando termina su día laboral , vuelve a saludar a los compañeros y se toma el subte para hacer el mismo recorrido. Se pone a descansar y a jugar a la PlayStation 4, ya que el día anterior se había descargado dos juegos. Uno de carreras y uno de aventuras. Los juegos lo aburren y se va a sentar frente a una ventana a tomarse un té .;;;;;;;
S6NH;M;JOVEN;Sin higiene;T2;Se levanta a las 7:30 y se dirige al armario para ponerse una camisa, una a cuadros y otra rayada elige la 2da. Después de eso va al baño, se lava la cara se cepilla los dientes se pone gel y se higieniza, Después de eso va a la cocina, se hace dos tostadas y toma mate. Cuando termina todo, va al trabajo. Va a la estación y camina 5 cuadras. El día está soleado. Después de eso llega al trabajo saluda a sus compañeros y atiende el telefono, Cuando termina su jornada laboral se va a su casa y se pone a jugar a la play a dos juegos. uno de autos y uno de aventuras. Después se va a tomar un té verde y se pone a leer un libro.;;;;;;;
S8NH;M;JOVEN;Sin higiene;E1;Juana se levanta a las 5:30 de la mañana, prepara todas sus cosas agarra su bolso y se va para el trabajo . Se toma un café antes. Se toma el subte el trabajo queda en Recoleta. Llega a la oficina tiene 2 reuniones. a las 8:30 se toma otro café. Tiene una reunión con gente de productores ejecutivos de toallitas femeninas LadySoft. Después de eso pide comida por delivery. en su hora de descanso almuerza, una vez que termina su jornada laboral pasa por el supermercado, compra lácteos, y un par de cosas más y paga en efectivo. Una vez que llega a su casa, se pone su equipo de gimnasia, escucha música alegre, sale a correr y hace su mismo recorrido. Después tiene una cita con alguien que conoció por Tinder, y alrededor de la medianoche se acuesta a dormir, revisa sus redes sociales, y después de 30 minutos logra conciliar el sueño.;;;;;;;
S8NH;M;JOVEN;Sin higiene;T1;Ana se levanta muy temprano, en la primer imagen se ve su departamento hay mesas silla televisor, una ventana, por la ventana se ven edificios, una mesita ratona un sillón, todo es muy blanco. Se levanta temprano se prepara un café y se va al trabajo. Agarra su bolso, va al trabajo, cuando llega recuerda que tiene dos reuniones, en el trabajo se ven los escritorios y dos sillas, los cuadros un sillón de espera y la puerta. Luego va a la reunión ,en la reunión hay 5 o 6 personas. Después de la reunión pasa por el supermercado, en la góndola de los lácteos compra cosas que necesita para la casa y paga en efectivo. después de eso, se iba a su departamento, se vestía de gimnasia y salía a correr, se ponía música y se la ve a ella corriendo por la vereda, tenía puestos auriculares, una calza negra, y una remera naranja. Después de eso, se va a una cita con una persona que conoció por Tinder, se va a un bar con mesitas en la vereda, medio rústico, y después de eso se va a su casa a dormir.;;;;;;;
