COD SUJETO;SEXO;EDAD;TRATAMIENTO;SESION;RELATO;;;;;;;
S53NH;F;JOVEN;Sin higiene;T2;La historia de una chica, ella vivia en el cuarto piso, se despertaba a las 7 y media de la mañana, va a reparar su desayuno, va a la estacion para dirigirse a su trabajo, en su trabajo despacha algunos mails, tiene una reunion con su jefa y tambien se veian a varias personas. Posteriormente se dirige a su casa, se alista xq tenina una reunion que habia coordinado x una app . Despues ella va a trota, despues regresa a su casa, se acuesta y demora un tiempo media hs aprox en conciliar el sueño;;;;;;;
L1NH;F;VIEJO;Sin higiene;E1;Despúes de una noche de sueño, JUANA SE DESPIERTA 7.30 EN SU DEPARTAMENTO DE CALLE CHARCAS. Toma su desayuno con mermelada de frutilla, se prepara para ir a trabajar. Se va al subte la estacion carranza del subte D par air a su trabajo en recoleta. LLega a su trabajo, se prepara cafe a las 8.30, revisa los mails y despues se va del trabajo a la tarde a tomar algo. Se va al supermercado, compra vegetales, lacteos y paga en efectivo. Despues se va a la casa , se quita la ropa, se pone ropa deportiva para ir a entrenar un poco, despues sale a entrenar a correr y hace siempr el mismo recorrido. Después vuelve y se prepara para ir a una cita que hizo en tinder, va a un bar y espera ahi a las 7.30 no recuerdo bien el horario. Despues va al lugar este a tomar algo, vuelve a media noche se acuesta a descansar;;;;;;;
L1NH;F;VIEJO;Sin higiene;T1;Juana se despierta, 7.30 de la mañana en su dpto de calle Charcas, se levanta desayuna mermelada de futilla, sale para trabajar, se va a la estacion de subte se va a trabajar a recoleta, llega al trabajo 8.30, toma un cafe, revisa los mail en la compu. Despues cuando termina su hs de trabajo se va a la casa , no se va al super, despues se va a la casa, compra lacteos y verduras, despues se va a la casa, se va a correr y despues se prepara porque tiene una cita en un bar, se va a la cita del bar y despues se va a la casa y a la media noche se va a dormir.;;;;;;;
L1NH;F;VIEJO;Sin higiene;E2;Federico luego de una noche de un largo sueño placentero sueño, se despierta 7.30 en su dpto de la calle Bacacay. Se levanta va al baño se cepilla los dientes, se peina, va al ropero, tiene dos camisas para elegir  una cuadros azules y otra a rayas, elige la de rayas, despues va a la cocina a preparar el desayuno y se prepara dos tostadas con queso crema y dulce de leche, despues sale a la calle y se va a la estacion de subte para ir a caballito, estacion de subte caballito. llega a su trabajo y a las 8 de la mañana sale de la casa cuando temrina el desayuno. Cuando llega al trabajo prende su computadora, se sirve un cafe, y bueno cuand termina su horario laboral se va, a la oficina queda en la calle saavedra en once, cuando se va de su trabajo se va a tomar el subte y se va a su casa, decide jugar a la play xq se habia descargado dos juegos la noche anterior uno de carrera y otro que no se. despues se aburre de jugar y se hace un te verde y se pone a leer un libro junto a la ventana;;;;;;;
L1NH;F;VIEJO;Sin higiene;T2;Federico luego d una noche placentera de sueño se despierta 7.30 en su depto que no me acuerdo si era carapachay el nombre, se levanta, se va al baño cepilla los dientes, se peina. Se va al ropero, tenia dos camisas una a rayas y una a cuadros azules, elige la de rayas, se cambia se va tomar el desayuno, se hace un cafe con dos tostadas con queso crema y dulce de leche, a las 8 de la mña termina de desayunar y sale para ir a trabajar. Se va a la estacion caballito, se va al trabajo, llega, prende la computadora y trabaja. Termina de trabajar se vuelve a su casa a jugar con la play y despues a la noche se toma un te y lee un libro.;;;;;;;
L2NH;F;VIEJO;Sin higiene;E1;Juana la imagen de su cuarto en su dpto de palermo, hay muchos almohadones en la cama grande, hay dos tazas en la mesa de luz, juana se levanta desayuna te en el balcon con dulce de frutillas. Se prepara para ir a su trabajo, toma el subte en la estacion carranza lleha a la oficina, en el subte viaja bastante gente. en la oficina hay un sillon d espera, una silla, un cuadro de la torre eiffel, y una compu, y unas plantas contra la pared como unos nichos. despues empieza a hacer su trabajo, tiene una reunion con la directora de arte grafico, pide la comida por delivery y come mientras descansa pero antes tuvo una reunion con sus compañeros por el lanzamiento de las toallitas femeninas lady soft, despues vuelve a su casa, pasa x el super compra lacteos y verduras. En el super se ve la gondola de los lacteos, despues llega a su casa se ve la mesa de la cocina con unas cajas de cereales sobre la mesa, una sillita de bebe, unos sillones, la mesa con sillas. Juana se cambia de ropa. se pone la ropa deportiva para salir a correr, hace el mismo recorrido de siempre, durante 40 min se pone musica divertida. despues lega a su casa y se prepara para una salida en un bar de san telmo en la calle tacuari, con M empezaba el nombre del bar, que se ve la fachada y unas mesas con gente afuera que esta sentada juana entra y se sienta para esperar a su cita . Para la medianoche llega a su casa y se acuesta y mira un libro, lee un libro de psicoanalista y despues de media hs se duerme.;;;;;;;
L2NH;F;VIEJO;Sin higiene;T1;En el dpto de juana q se levanta a las 6 de la mañana una imagen de una habitacion que habia una cama, con unos almohadones, habia dos tazas en la mesa de luz, Juana se levanta para desayunar estaba en el balcon con una taza de te, que le gustaba el te con dulce de frutilla. Despues se iba para el trabajo que habia una reunion. en su oficina habia un cuadro de la torre eiffel, un escritorio con silla con lámpara computadora, habia un sillon negro tambien como de sala de espera. Tenia la reunion con su jefa su equipo de trabajo por una campaña para las toallitas femeninas lady soft. Tambien despues pedia comida por delivery y almorzaba en el trabajo y cuando ella volvia a su casa se cambiaba, se ponia ropa deportiva para hacer su rutina de que salia a correr por 40 min escuchando musica divertida. En el ambiente de su casa habia una mesa grande con sillas en la cocina, una silla para bebe. despues volvia para su casa, salia xq tenia una cita por una no me acuerdo Y bueno se iba a un bar se iba a encontrar con su cita, ella se sentaba en la barra a esperarlo. era un bar que tenia sillas en la calle, habia gente que estaba sentada cuando ella se iba a correr se iba con los auriculares puestos, y volvia para su casa como a la medianoche y antes de dormir creo que leia un libro, en algun momento tambien veia sus redes sociales y sus contactos creo que cuando estaba en la oficina y depues de media hora de estar acostada se dormia.;;;;;;;
L2NH;F;VIEJO;Sin higiene;E2;Federico que esta durmiendo se levanta 7.30 duerme en una cama llena de almohadas dice que tuvo un buen sueño. Se levanta abre su vestidor ve que tiene muchas camisas y elige entre una a cuadros y una rayada, elige la rayada, pero despues cuando va a la calle  se ve que cambio de opinion porque tiene una negra. Despues va al baño a higienizarse, el baño esta implecable tiene muchos adornos esta muy limpio hay unas toallas como color naranja, hay unas cosas verdes tipo hojas verdes y unos vasos verdes, todo super lindo. se prepara el desayuno va a la cocina que tambien esta impecable, desayuna dos tostadas con queso crema y dulce de leche . Despues se va para el trabajo, vive en la calle bacacay se va hacia la estacion del tren de caballito, camina 5 cuadras toma el tren para ir a su trabajo a la calle saavedra en once llega a la oficina que tambien esta impecable todo super ordenado, se prepara un cafe y hace unas llamadas y despues se despide de sus compañeros, hay alguien reparando un vidrio. Despues se va para su casa se pone a jugar  con la play 4 que se habia descargado dos juegos la noche anterior que los queria probar, uno de carrera y otro de aventuras, pero se aburre, y se prepara un te verde y se pone a leer junto a la ventana.;;;;;;;
L2NH;F;VIEJO;Sin higiene;T2;Federico que se despierta 6.30 de la mañana esta durmiendo en una cama llena de almohadas rodeado de almohadas, se levanta va para la ducha esta todo impecable elige en su vestidor esta entre una camisa a cuadros o una camisa rayada, finalmente cuando sale de su casa  despues de desayunar no me acuerdo que con queso blanco y dulce de leche creo, sale tiene puesta una remera negra, camina 5 cuadras hasta la estacion caballito, no me acuerdo si la calle era Bacacay o Boyaca, llega a su trabajo hace llamados telefonicos despues cuando vuelve a su casa se pone a jugar a la play 4 se habia comprado dos juegos o descargado peor se aburrio, se sienta a leer, toma un te verde y despues de media hs se acuesta a dormir;;;;;;;
L3NH;F;VIEJO;Sin higiene;E1;Juana vive en la calle charcas en el barrio de belgrano, se levanto a las 7.30 desayuno dos tostadas y una taza de cafe con leche, fue a la estacion maqinista carranza a su trabajo. en su trabajo cuando llego mails atrasados tomando una taza de cafe a las 8.30 despues tuvo la reunion de trabajo, al mediodia se encargo comida y durante su descanso almorzo, luego terminada la tarea del trabajo fue al super compro lo que necesitaba algunos lacteos, verdura. Fue a la casa los deposito los arrego, se cambio, se puso el traje de gimnasia, fue a hacer una hora de training siempre el mismo recorrido, luego volvio se cambio y fue a una cita que contrajo por tinder en un bar de la calle tacuari, se sento en la barra, a las 12.30 llego a su casa, leyo media hs y se durmio;;;;;;;
L3NH;F;VIEJO;Sin higiene;T1;Juana se levanta 7.30 desayuna cafe con leche con dos tostadas, a las 8.30 esta presente en su oficina respondiendo mensajes atrasados en la ofcina toma una taza de cafe. Luego durante la mañana se reune con sus compañeros para la presentacion de la presentacion de la publicidad de las toallitas higienicas Luego almuerza con sus compañeros y a la tarde dspues del trabajo va al supermercado a comprar frutas y verduras, deja todo en la casa se cambia y va a hacer su caminata de footing x el barrio luego vuelve se arregla y va a una cita en la calle tacuari en un bar que una cita que consiguio por tinder. Doce y media se acuesta Omiti decir que ella vive en belgrano y tome el subte en la estacion carranza;;;;;;;
L3NH;F;VIEJO;Sin higiene;E2;Federico vive en el barrio de caballito en la calle bacacay, se lavanta siete y media se va a higienizar se lava los dientes se pone gel va a desayunar con dos tostadas con dulce de leche y queso, a las ocho sale de la casa, previamente aparentemente tenia que elegir entre dos camisas elegia la rayada y despues en el video se lo ve con una remera negra. Sale va a la estacion de caballito del tren que la tiene a 5 cuadras y se baja en la estacion once para ir a su trabajo. llega a su trabajo se toma un cafe se dedica a responder llamadas durante el dia no me acuerdo que pase nada mas, cuando se va vuelve a su casa y se dedica a limpiar el patio despues de limpiar el patio se pone a jugar con la playstation 4, el dia anterior descargo dos videos, uno sobre carrera de coches, pero mientras esta jugando esta pensando que va a preparar de cena y se aburre un poco entonces deja los juegos y va a la ventana a leer un libro mientras el sol va bajando;;;;;;;
L3NH;F;VIEJO;Sin higiene;T2;Se llama federico se despierta siete y media, se ducha y se pone gel, desayuna con dos tostadas una de queso crema y dulce de leche y a las ocho se va a la estacion caballito porque vive en la calle bacacay. ahi durante quince min espera el tren, llegó a la oficina y con una taza de cafe se dispone a responder correos atrasados pasa trabajando todo el dia cuando llega a la casa de regreso se pone a limpiar el patio. Despues se dedica a jugar con la play con dos jueguitos que compro el dia anterior uno de ellos de carrera de autos. como un poco se aburre se pone a leer un libro. al trabajo se fue con una remera negra pese a que estuvo buscando camisas y eligio una rayada.;;;;;;;
L4NH;F;VIEJO;Sin higiene;E1;Juana se despierta a las siete y cuarto de la mañana se prepara para ir a tabajar. La habitacion es muy luminosa y tiene una ventana donde entra el sol. Se levanta, se sienta a tomar su desayuno vive en charcas belgrano, despues de tomar su taza de cafe con leche mientras mira por la ventana baja y se va a tomar a la estacion de subte toma la linea D que la lleva a su trabajo. Cuando llega a la oficina, es muy linda y luminosa tambien, se recuerda que tiene que hacer varias llamadas antes de ponerse a trabajar. Las realiza, luego se pone a trabajar, recuerda que tinee una reunion al mediodia de trabajo con su jefe y otros compañeros de oficina. Despues de ahi cuando termina la jornada laboral pasa por el super a hacer la compra, compra lacteos, verduras, paga en efectivo, y se vuelve a su casa, donde entra una cocina tambien impecable, todo ordenado, muy moderna, ordena todo se viste de gimnasia y sale a correr por un espacio muy despejado no hay tannots edificios, siempre hace el mismo recorrido despues de ese paseo tiene una cita que habia quedado en tinder asique se cambia y va a la confiteria que no recuerdo el nombre de la calle. luego cuando regresa a su depto lee el analista antes de quedarse dormida. Las imagenes de la protagonista para mi no es la misma del inicio al final.;;;;;;;
L4NH;F;VIEJO;Sin higiene;T1;Juana. Se levanta temprano, esta la imagen de su depto del cuarto, yo lo que marcaba es que estaba muy ilumindado habia cuadros. Vive en palermo, no me acuerdo la calle, va al subte toma el subte d, se va al trabajo, cuando llega a la oficna se acuerda que tiene que hacer varias llamadas antes de empezar a trabajar , solo se ven los muebles de la oficina ella no se ve. Ah pero antes de bajar a tomar el subte desayuna . Toma su taza de te con leche frente a la ventana. DEspues tiene una reunion con su jefa y otros compaleros de trabajo, cuando termina de trabajar camino a su casa pasa por el super, compra verduras y lacteos, paga en efvo. Cuando lega a su casa se ve una cocina muy ordenada impecable, ordena las cosas que compro , se viste de gimnasia y sale a hacer un recorrido que hace habitualmente. es una zona muy linda, muy despejada, con mucha luz. El recorrido que hace es el de siempre, despues regresa a su casa y no me acuerdo como cierra.;;;;;;;
L4NH;F;VIEJO;Sin higiene;E2;Federico, se despierta a las 7.30 de la mañana para ir a trabajar, vive en el barrio de caballito. se levanta va al baño, se lava los dientes se peina, el baño es todo blanco, las toallas de color naranja. Cuando termina se va a la cocina, pone el agua para el mate come una tostada con dulce de leche y no se que cosa. La cocina tambien son unos muebles blancos. termina el desayuno a las 8 de la mañana agarra su mochila y se dirige a su oficina, cuando esta en el anden espera unos 15 minutos cuando llega el tren sube y se va a su oficina en el barrio de once. Llega saluda a sus compañeros, hace unas llamadas, en el escritorio esta la computadora y un celular. Cuando termina su horario saluda a sus compañeros llega a su casa y decide limpiar el patio. despues quiere jugar a la playstation 4 con dos nuevos juegos que habia bajado. Jugo un rato, se aburre de los juegos, se prepara un te verde y lee un libro mientras piensa que va a preparar para la cena.;;;;;;;
L4NH;F;VIEJO;Sin higiene;T2;Federico se despierta  7.30 de la mañana, esta la vista de su cuarto, se levanta va al baño, y se cepilla los dientes se lava a cara se peina, en el baño recuerdo que predomina todo blanco, tiene toallas color naranja y algunos adornos de plantas verdes, despues va a la cocina a desayunar, creo que pone agua para el mate no recuerdo que es lo que come. Baja a tomar el subte y se dirige a once que esta la oficina donde trabaja, cuando llega saluda a todos los compañeros, gace llamados telefonicos, y al final de la jornada cuando se retira de la oficina, vuelve a saludar a sus compañeros, decide ordenar el patio de su casa, esta un rato ahi, despues decide estrenar la play que compro nueva con dos juegos, esta un rato se aburre, y decide leer un libro. Y creo que es eso lo ultimo que hace antes de irse a dormir.;;;;;;;
L5H;M;VIEJO;Con higiene;E1;Juana se levanta a las siete y media desayuna dos tostadas con manteca y mermelada de frutilla, luego sale de su casa y se va a tomar el subte a la est carranza para ir a su oficina que esta en el centro, llega a su oficina se sirve otro cafe y comienza a contestar mails que tiene atrasados, despues al mediodia tienen una reunion de oficina para promocionar un producto creo Luego de eso sigue por la tarde en la oficina cuando termina sale de la oficina y antes de llegar a su casa pasa por el supermercado y compra lacteos y verduras y no recuerdo mas Se va a su casa se cambia se pone ropa deportiva y sale a caminar o trotar por el barrio, despues tiene una cita x tinder, en un negocio en la calle tacuari entonces se va ahi en l barra espera encontrarse con la persona que se habia citado y vuelve a su casa a media noche. Ahi medio que me perdi, creo que lee algo del psicoanalista, y despues de eso se acuesta y le lleva masomenos 30 min hasta q se duerme;;;;;;;
L5H;M;VIEJO;Con higiene;T1;No me acuerdo nada, era algo sobre una chica q iba a trabajar, en subte No me acuerdo mas.;;;;;;;
L5H;M;VIEJO;Con higiene;E2;Estaba durmiendo, vive en caballito, se levanta mira su guardarropa ver que camisa se va a poner pero despues sale con una remera negra se levanta y va al baño, se higieniza, se peina se pone algo en la cabeza no me acuerdo el nombre. luego se va a la cocina se prepara el mate se come dos tostadas con queso crema y dulce de leche, una vez qe temina de desayunar sale a la calle y se dirige a la estacion de caballito que esta a 5 cuadras, llega a la estacion, camina hacia el final del anden, llega el tren, lo toma baja en once porque trabaja en una empresa q esta en la calle saavedra, llega a la oficina saluda a sus compañeros, se toma un cafe y se pone a trabajar. Al atardecer cuando sale de la oficina se despide de sus compañeros, llega a su casa y se pone a jugar con la play que el habia bajado dos juegos nuevos los queria probar, pero al mismo tiempo esta pensando que va a cenar pero uno de los juegos lo aburre y se pone frente a la ventana y se pone a leer un libro.;;;;;;;
L5H;M;VIEJO;Con higiene;T2;Federico esta durmiendo, vive en caballito, se levanta mira su guardarropa ve una camisa a cuadros luego va al baño se higieniza se peina, luego se dirige a la cocina se prepara un cafe y dos tostadas con queso crema y dulce de leche. cuando termina de desayunar se viste y sale a la calle para ir a la estacion caballito que queda a 5 cuadras de su casa. Sale con una remera negra. Llega el tren , perdon llega a la esacion luego viene el tren lo toma y se baja en once xq el trabaja en una oficina en la calle saavedra. Llega a la oficina saluda a sus compañeros, toma un cafe y despues comienza a trabajar, escribe y hace llamadas telefonicas al finalizar su jornada laboral sale y se dirige a tmar el tren baja en caballito y vuelve a su casa. se pone a jugar con la play para probar un juego que habia comprado el dia anterior. como aparentemente mucho no le agrada lo que hace es irse a la ventana, toma un libro y se lo pone a leer.;;;;;;;
L6H;F;VIEJO;Con higiene;E1;"La chica se levanta de su dpto despues de haber descansado bastante bien, desayuna dos tostadas con manteca y mermelada de frutilla y un cafe. Luego va a la oficina empieza a responder llamados pendientes luego tiene una reunion con la jefa y presentan un producto nuevo el lanzamiento de lady soft para toallas femeninas para mujres, despues va a su casa se cambia la ropa hace un entrenamiento de unos 40 min como lo hace en el recorrido habitual, lleva agua, luego tiene una cita por tinder en un bar de la calle Tacuari. llega a su casa lee el psicoanalista y se conecta a las redes sociales antes de dormirse. Hace la compra en el supermercado, compra lacteos y compra verduras. Agrego datos que me vienen a la mente; Ella vive en un 4 piso en la calle charcas en el barrio de palermo. O la oficina era ahi? ahora se me esta confundiendo. Luego toma el subterraneo la linea d de la estacion carranza para el lado de catedral.";;;;;;;
L6H;F;VIEJO;Con higiene;T1;Una chica se levanta en du depto despues de haber pasado una buena noche, desayuna dos tostadas con mermelada de frutilla y manteca y cafe creo despues se dirige a su oficina, toma el subte en la estacion carranza. Su depto esta ubicado en la calle charcas en el barrio de palermo. Llega a la oficina, responde mails tiene reuniones y luegon va al supermercado compra verduras y lacteos, tenia una cita por tinder, y luego regresa y antes de dormirse ve una serie o algo asi. La cita era en la calle tacuari. Me acorde de algo del trabajo que tenian que presentar un producto de toallas femeninas para mujeres.;;;;;;;
L6H;F;VIEJO;Con higiene;E2;Federico se levanta a las siete y media en su depto de la calle bacacay, abre el armario y no sabe que camisa ponerse esta entre dos opciones una azul a cuadros y otra a rayas. Luego va al baño, se peina se coloca gel para su cabello se lava los dientes y la cara . Va a la cocina y desayuna tostadas con queso crema y dulce de leche . luego se dirige a unas cuadras de su casa a la estacion caballito de tren y espera 15 min hasta que llega el tren. Su trabajo queda en once en la calle saavedra, llega a la oficina enciende la computadora y realiza llamadas telefonicas y despues que llega a su casa limpia el vidrio y se habia comprado los juegos nuevos de play numero 4 uno de carreras y otro de aventuras, pero como le aburren se toma un te verde y se lee un libro.;;;;;;;
L6H;F;VIEJO;Con higiene;T2;Federico se despierta en su depto ubicado en caballito, no se decide que camisa ponerse luego desayuna tostadas con dulce de leche y queso crema y se dirige a la estacion caballito de tren y va hacia once donde esta su oficina de trabajo. Ahi responde mails y llamadas luego va a su casa y mira la play 4 tenia dos juegos pero no lo entusiasmaron entonces termina leyendo un libro mientras se toma un te verde.;;;;;;;
L7H;F;VIEJO;Con higiene;E1;Juana se levanta despues de una buena noche de sueño a las 7, toma el desayuno cafe con dos tostadas con manteca y dulce de frutilla. despues de arreglarse baja y se dirige a la est ministro carranza donde toma el subte para ir a su trabajo para ir a recoleta. Primero se sienta a responder unos mails xq tiene una reunion con la jefa. en la reunion discute sobre el lanzamiento de unas toallitas femeninas, un nuevo producto . despues pide su almuerzo por delivery, cuando termina su jornada laboral hace comprar en el super, compr verduras, lacteos, paga en efectivo. Vuelve a su casa, se cambia, guarda sus compras se pone la ropa deportiva y se va a hacer 40 min de actividad fisica que hace siempre me le mismo recorrido. Vuelve a su casa y se prepara para una cita que hizo por tinder en un bar de la calle tacuari. Vuelve a su casa despues de la medianoche, lee el libro el psicoanalista, revisa sus redes sociales y despues de media hora se duerme.;;;;;;;
L7H;F;VIEJO;Con higiene;T1;Juana se levanta no me acuerdo si era 7 o 7 y media toma el desayuno con cafe dos tostadas con dulce de frutilla, creo que despues se bañaba no me acuerdo, se prepara sale a su trabajo toma el subte a la estacion carranza y el trabajo de ella es en recoleta. cuando llega responde los mails antes de una reunion con su jefa que era por el lanzamiento de un nuevo producto cuando termina de trabajar va a su casa se pone ropa deportiva sal a hacer act fisica haciendo siempre el mismo recorrido. cuando vuelve se prepara para una cita que tiene por tinder que era en un bar de la calle tacuari, despues vuelve cerca de la medianoche, lee media hs, que no me acuerdo mencionaba el libro pero no me acuerdo y se va a dormir.;;;;;;;
L7H;F;VIEJO;Con higiene;E2;Federico se despierta a las siete y media de la mañana despues de una buena noche de sueño, se fija que es lo que se va a poner y tiene entre las opciones una camisa azul con cuadros y una rayada y elige la segunda. Va al baño, se higieniza, se peina, se pone el gel se lava los dientes. Despues se va a la cocina pone la pava electrica para el mate, y se repara tostadas con queso crema y dulce de leche. despues sale de su casa que no se va con la camisa que eligio, se va con remera negra. el depto esta en la calle bacacay del barrio de caballito despues camina hasta la estacion caballito que esta a 5 cuadras y el dia esta soleado pero humedo, se va al final del anden y a los 15 min se toma el tren llega a su oficina que esta en la calle Saavedra del barrio de once. Se sirve un cafe, saluda a sus compañeros, prende su computadora y empieza a hacer llamadas laborales. Cuando termina de trabajar vuelve a su casa y decide limpiar el patio despues se toma un descanso y juega a la play 4 que tiene dos juegos nuevos que se bajo, una de carreras y otro creo que de aventuras. Mientras tanto piensa que va a cocinarse para la noche. Se aburre del juego, y se va a leer un libro tomando un poco de aire cerca de una ventana.;;;;;;;
